{"iter": 43, "ts": "2026-04-25 19:09:19", "stage": "evaluated", "verdict_ok": true, "proposal": {"knob": "d_ff", "new_value": 6144, "reason": "Increase FFN hidden dim for better expressiveness"}, "diff": "--- a/cfg.py\n+++ b/cfg.py\n@@ -1 +1 @@\n-    d_ff: int = 4096\n+    d_ff: int = 6144\n", "candidate_cfg": {"n_layer": 24, "n_head": 16, "d_model": 1024, "d_ff": 6144, "lr": 0.0003, "lr_warmup": 5, "grad_clip": 1.0, "weight_decay": 0.0, "beta1": 0.9, "beta2": 0.95, "batch_size": 16, "seq_len": 1024, "precision": "fp8", "vocab_size": 50257, "steps": 60, "val_chunk_tokens": 16384, "seed": 0}, "eval_metrics": {"ok": true, "params_m": 455.27, "train_steps": 60, "train_loss_first": 11.067, "train_loss_last": 7.425, "val_bpb": 10.8989, "val_n_batches": 1, "mean_step_ms": 1323.61, "train_wall_s": 79.4, "val_wall_s": 0.4, "peak_gpu_mem_gib": 27.37}, "val_bpb": 10.8989, "baseline_val_bpb": 10.9554, "improvement_frac": 0.0052, "decision": "keep", "is_new_best": false, "nim_latency_s": 1.28, "iter_wall_s": 81.8}
{"iter": 44, "ts": "2026-04-25 19:11:01", "stage": "evaluated", "verdict_ok": true, "proposal": {"knob": "d_model", "new_value": 1536, "reason": "Increase hidden dim to see if it improves validation performance."}, "diff": "--- a/cfg.py\n+++ b/cfg.py\n@@ -1 +1 @@\n-    d_model: int = 1024\n+    d_model: int = 1536\n", "candidate_cfg": {"n_layer": 24, "n_head": 16, "d_model": 1536, "d_ff": 4096, "lr": 0.0003, "lr_warmup": 5, "grad_clip": 1.0, "weight_decay": 0.0, "beta1": 0.9, "beta2": 0.95, "batch_size": 16, "seq_len": 1024, "precision": "fp8", "vocab_size": 50257, "steps": 60, "val_chunk_tokens": 16384, "seed": 0}, "eval_metrics": {"ok": true, "params_m": 607.4, "train_steps": 60, "train_loss_first": 11.17, "train_loss_last": 7.484, "val_bpb": 10.9686, "val_n_batches": 1, "mean_step_ms": 1649.01, "train_wall_s": 99.0, "val_wall_s": 0.48, "peak_gpu_mem_gib": 29.42}, "val_bpb": 10.9686, "baseline_val_bpb": 10.9554, "improvement_frac": -0.0012, "decision": "revert", "is_new_best": false, "nim_latency_s": 1.35, "iter_wall_s": 101.5}
{"iter": 45, "ts": "2026-04-25 19:12:03", "stage": "evaluated", "verdict_ok": true, "proposal": {"knob": "d_model", "new_value": 768, "reason": "smaller hidden dimension may help"}, "diff": "--- a/cfg.py\n+++ b/cfg.py\n@@ -1 +1 @@\n-    d_model: int = 1024\n+    d_model: int = 768\n", "candidate_cfg": {"n_layer": 24, "n_head": 16, "d_model": 768, "d_ff": 4096, "lr": 0.0003, "lr_warmup": 5, "grad_clip": 1.0, "weight_decay": 0.0, "beta1": 0.9, "beta2": 0.95, "batch_size": 16, "seq_len": 1024, "precision": "fp8", "vocab_size": 50257, "steps": 60, "val_chunk_tokens": 16384, "seed": 0}, "eval_metrics": {"ok": true, "params_m": 247.08, "train_steps": 60, "train_loss_first": 10.938, "train_loss_last": 7.498, "val_bpb": 10.8534, "val_n_batches": 1, "mean_step_ms": 1008.66, "train_wall_s": 60.5, "val_wall_s": 0.31, "peak_gpu_mem_gib": 21.98}, "val_bpb": 10.8534, "baseline_val_bpb": 10.9554, "improvement_frac": 0.0093, "decision": "keep", "is_new_best": true, "nim_latency_s": 1.11, "iter_wall_s": 62.6}
{"iter": 46, "ts": "2026-04-25 19:13:34", "stage": "evaluated", "verdict_ok": true, "proposal": {"knob": "d_ff", "new_value": 8192, "reason": "Increase FFN hidden dim to improve model capacity"}, "diff": "--- a/cfg.py\n+++ b/cfg.py\n@@ -1 +1 @@\n-    d_ff: int = 4096\n+    d_ff: int = 8192\n", "candidate_cfg": {"n_layer": 24, "n_head": 16, "d_model": 1024, "d_ff": 8192, "lr": 0.0003, "lr_warmup": 5, "grad_clip": 1.0, "weight_decay": 0.0, "beta1": 0.9, "beta2": 0.95, "batch_size": 16, "seq_len": 1024, "precision": "fp8", "vocab_size": 50257, "steps": 60, "val_chunk_tokens": 16384, "seed": 0}, "eval_metrics": {"ok": true, "params_m": 555.93, "train_steps": 60, "train_loss_first": 11.064, "train_loss_last": 7.502, "val_bpb": 10.8885, "val_n_batches": 1, "mean_step_ms": 1467.05, "train_wall_s": 88.0, "val_wall_s": 0.45, "peak_gpu_mem_gib": 30.33}, "val_bpb": 10.8885, "baseline_val_bpb": 10.9554, "improvement_frac": 0.0061, "decision": "keep", "is_new_best": false, "nim_latency_s": 1.27, "iter_wall_s": 90.4}
{"iter": 47, "ts": "2026-04-25 19:14:51", "stage": "evaluated", "verdict_ok": true, "proposal": {"knob": "n_head", "new_value": 32, "reason": "Increase attention heads to improve representation capacity"}, "diff": "--- a/cfg.py\n+++ b/cfg.py\n@@ -1 +1 @@\n-    n_head: int = 16\n+    n_head: int = 32\n", "candidate_cfg": {"n_layer": 24, "n_head": 32, "d_model": 1024, "d_ff": 4096, "lr": 0.0003, "lr_warmup": 5, "grad_clip": 1.0, "weight_decay": 0.0, "beta1": 0.9, "beta2": 0.95, "batch_size": 16, "seq_len": 1024, "precision": "fp8", "vocab_size": 50257, "steps": 60, "val_chunk_tokens": 16384, "seed": 0}, "eval_metrics": {"ok": true, "params_m": 354.6, "train_steps": 60, "train_loss_first": 11.086, "train_loss_last": 7.437, "val_bpb": 10.9398, "val_n_batches": 1, "mean_step_ms": 1251.29, "train_wall_s": 75.1, "val_wall_s": 0.37, "peak_gpu_mem_gib": 24.36}, "val_bpb": 10.9398, "baseline_val_bpb": 10.9554, "improvement_frac": 0.0014, "decision": "revert", "is_new_best": false, "nim_latency_s": 1.14, "iter_wall_s": 77.3}
{"iter": 48, "ts": "2026-04-25 19:16:04", "stage": "evaluated", "verdict_ok": true, "proposal": {"knob": "d_ff", "new_value": 4096, "reason": "Returning to previous successful d_ff value"}, "diff": "--- a/cfg.py\n+++ b/cfg.py\n@@ -1 +1 @@\n-    d_ff: int = 4096\n+    d_ff: int = 4096\n", "candidate_cfg": {"n_layer": 24, "n_head": 16, "d_model": 1024, "d_ff": 4096, "lr": 0.0003, "lr_warmup": 5, "grad_clip": 1.0, "weight_decay": 0.0, "beta1": 0.9, "beta2": 0.95, "batch_size": 16, "seq_len": 1024, "precision": "fp8", "vocab_size": 50257, "steps": 60, "val_chunk_tokens": 16384, "seed": 0}, "eval_metrics": {"ok": true, "params_m": 354.6, "train_steps": 60, "train_loss_first": 10.98, "train_loss_last": 7.438, "val_bpb": 10.9337, "val_n_batches": 1, "mean_step_ms": 1184.59, "train_wall_s": 71.1, "val_wall_s": 0.35, "peak_gpu_mem_gib": 24.33}, "val_bpb": 10.9337, "baseline_val_bpb": 10.9554, "improvement_frac": 0.002, "decision": "revert", "is_new_best": false, "nim_latency_s": 1.19, "iter_wall_s": 73.2}
{"iter": 49, "ts": "2026-04-25 19:18:19", "stage": "evaluated", "verdict_ok": true, "proposal": {"knob": "d_model", "new_value": 2048, "reason": "increase hidden dimension to improve model capacity"}, "diff": "--- a/cfg.py\n+++ b/cfg.py\n@@ -1 +1 @@\n-    d_model: int = 1024\n+    d_model: int = 2048\n", "candidate_cfg": {"n_layer": 24, "n_head": 16, "d_model": 2048, "d_ff": 4096, "lr": 0.0003, "lr_warmup": 5, "grad_clip": 1.0, "weight_decay": 0.0, "beta1": 0.9, "beta2": 0.95, "batch_size": 16, "seq_len": 1024, "precision": "fp8", "vocab_size": 50257, "steps": 60, "val_chunk_tokens": 16384, "seed": 0}, "eval_metrics": {"ok": true, "params_m": 910.53, "train_steps": 60, "train_loss_first": 11.208, "train_loss_last": 7.513, "val_bpb": 10.9334, "val_n_batches": 1, "mean_step_ms": 2205.21, "train_wall_s": 132.3, "val_wall_s": 0.61, "peak_gpu_mem_gib": 34.83}, "val_bpb": 10.9334, "baseline_val_bpb": 10.9554, "improvement_frac": 0.002, "decision": "revert", "is_new_best": false, "nim_latency_s": 1.2, "iter_wall_s": 135.0}
{"iter": 50, "ts": "2026-04-25 19:19:34", "stage": "evaluated", "verdict_ok": true, "proposal": {"knob": "n_head", "new_value": 8, "reason": "try fewer attention heads"}, "diff": "--- a/cfg.py\n+++ b/cfg.py\n@@ -1 +1 @@\n-    n_head: int = 16\n+    n_head: int = 8\n", "candidate_cfg": {"n_layer": 24, "n_head": 8, "d_model": 1024, "d_ff": 4096, "lr": 0.0003, "lr_warmup": 5, "grad_clip": 1.0, "weight_decay": 0.0, "beta1": 0.9, "beta2": 0.95, "batch_size": 16, "seq_len": 1024, "precision": "fp8", "vocab_size": 50257, "steps": 60, "val_chunk_tokens": 16384, "seed": 0}, "eval_metrics": {"ok": true, "params_m": 354.6, "train_steps": 60, "train_loss_first": 10.929, "train_loss_last": 7.443, "val_bpb": 10.9601, "val_n_batches": 1, "mean_step_ms": 1209.93, "train_wall_s": 72.6, "val_wall_s": 0.37, "peak_gpu_mem_gib": 24.32}, "val_bpb": 10.9601, "baseline_val_bpb": 10.9554, "improvement_frac": -0.0004, "decision": "revert", "is_new_best": false, "nim_latency_s": 1.05, "iter_wall_s": 74.7}
{"stage": "loop_complete", "iters_requested": 50, "accept_count": 8, "revert_count": 42, "block_count": 0, "eval_fail_count": 0, "loop_wall_s": 4406.4, "loop_wall_min": 73.4, "baseline_val_bpb": 10.9554, "best_val_bpb": 10.8534, "best_proposal": {"knob": "d_model", "new_value": 768, "reason": "smaller hidden dimension may help"}, "best_improvement_frac": 0.0093}
