{"iter": 22, "ts": "2026-04-25 18:36:59", "stage": "evaluated", "verdict_ok": true, "proposal": {"knob": "n_head", "new_value": 32, "reason": "Increase attention heads to improve model capacity."}, "diff": "--- a/cfg.py\n+++ b/cfg.py\n@@ -1 +1 @@\n-    n_head: int = 16\n+    n_head: int = 32\n", "candidate_cfg": {"n_layer": 24, "n_head": 32, "d_model": 1024, "d_ff": 4096, "lr": 0.0003, "lr_warmup": 5, "grad_clip": 1.0, "weight_decay": 0.0, "beta1": 0.9, "beta2": 0.95, "batch_size": 16, "seq_len": 1024, "precision": "fp8", "vocab_size": 50257, "steps": 60, "val_chunk_tokens": 16384, "seed": 0}, "eval_metrics": {"ok": true, "params_m": 354.6, "train_steps": 60, "train_loss_first": 10.979, "train_loss_last": 7.445, "val_bpb": 10.9618, "val_n_batches": 1, "mean_step_ms": 1350.8, "train_wall_s": 81.1, "val_wall_s": 0.41, "peak_gpu_mem_gib": 24.35}, "val_bpb": 10.9618, "baseline_val_bpb": 10.9554, "improvement_frac": -0.0006, "decision": "revert", "is_new_best": false, "nim_latency_s": 1.27, "iter_wall_s": 83.3}
{"iter": 23, "ts": "2026-04-25 18:38:06", "stage": "evaluated", "verdict_ok": true, "proposal": {"knob": "d_model", "new_value": 768, "reason": "smaller hidden dim may reduce overfitting"}, "diff": "--- a/cfg.py\n+++ b/cfg.py\n@@ -1 +1 @@\n-    d_model: int = 1024\n+    d_model: int = 768\n", "candidate_cfg": {"n_layer": 24, "n_head": 16, "d_model": 768, "d_ff": 4096, "lr": 0.0003, "lr_warmup": 5, "grad_clip": 1.0, "weight_decay": 0.0, "beta1": 0.9, "beta2": 0.95, "batch_size": 16, "seq_len": 1024, "precision": "fp8", "vocab_size": 50257, "steps": 60, "val_chunk_tokens": 16384, "seed": 0}, "eval_metrics": {"ok": true, "params_m": 247.08, "train_steps": 60, "train_loss_first": 11.002, "train_loss_last": 7.521, "val_bpb": 10.8575, "val_n_batches": 1, "mean_step_ms": 1070.99, "train_wall_s": 64.3, "val_wall_s": 0.31, "peak_gpu_mem_gib": 21.97}, "val_bpb": 10.8575, "baseline_val_bpb": 10.9554, "improvement_frac": 0.0089, "decision": "keep", "is_new_best": true, "nim_latency_s": 1.33, "iter_wall_s": 66.4}
{"iter": 24, "ts": "2026-04-25 18:40:28", "stage": "evaluated", "verdict_ok": true, "proposal": {"knob": "d_model", "new_value": 2048, "reason": "Increase hidden dimension for better representation capacity"}, "diff": "--- a/cfg.py\n+++ b/cfg.py\n@@ -1 +1 @@\n-    d_model: int = 1024\n+    d_model: int = 2048\n", "candidate_cfg": {"n_layer": 24, "n_head": 16, "d_model": 2048, "d_ff": 4096, "lr": 0.0003, "lr_warmup": 5, "grad_clip": 1.0, "weight_decay": 0.0, "beta1": 0.9, "beta2": 0.95, "batch_size": 16, "seq_len": 1024, "precision": "fp8", "vocab_size": 50257, "steps": 60, "val_chunk_tokens": 16384, "seed": 0}, "eval_metrics": {"ok": true, "params_m": 910.53, "train_steps": 60, "train_loss_first": 11.307, "train_loss_last": 7.513, "val_bpb": 10.9479, "val_n_batches": 1, "mean_step_ms": 2322.09, "train_wall_s": 139.3, "val_wall_s": 0.66, "peak_gpu_mem_gib": 34.83}, "val_bpb": 10.9479, "baseline_val_bpb": 10.9554, "improvement_frac": 0.0007, "decision": "revert", "is_new_best": false, "nim_latency_s": 1.25, "iter_wall_s": 142.1}
{"iter": 25, "ts": "2026-04-25 18:41:49", "stage": "evaluated", "verdict_ok": true, "proposal": {"knob": "beta2", "new_value": 0.96, "reason": "slightly increase beta2 for more aggressive decay"}, "diff": "--- a/cfg.py\n+++ b/cfg.py\n@@ -1 +1 @@\n-    beta2: float = 0.95\n+    beta2: float = 0.96\n", "candidate_cfg": {"n_layer": 24, "n_head": 16, "d_model": 1024, "d_ff": 4096, "lr": 0.0003, "lr_warmup": 5, "grad_clip": 1.0, "weight_decay": 0.0, "beta1": 0.9, "beta2": 0.96, "batch_size": 16, "seq_len": 1024, "precision": "fp8", "vocab_size": 50257, "steps": 60, "val_chunk_tokens": 16384, "seed": 0}, "eval_metrics": {"ok": true, "params_m": 354.6, "train_steps": 60, "train_loss_first": 11.039, "train_loss_last": 7.439, "val_bpb": 10.9335, "val_n_batches": 1, "mean_step_ms": 1305.03, "train_wall_s": 78.3, "val_wall_s": 0.38, "peak_gpu_mem_gib": 24.33}, "val_bpb": 10.9335, "baseline_val_bpb": 10.9554, "improvement_frac": 0.002, "decision": "revert", "is_new_best": false, "nim_latency_s": 1.42, "iter_wall_s": 80.8}
{"iter": 26, "ts": "2026-04-25 18:43:40", "stage": "evaluated", "verdict_ok": true, "proposal": {"knob": "d_model", "new_value": 1536, "reason": "increase hidden dimension"}, "diff": "--- a/cfg.py\n+++ b/cfg.py\n@@ -1 +1 @@\n-    d_model: int = 1024\n+    d_model: int = 1536\n", "candidate_cfg": {"n_layer": 24, "n_head": 16, "d_model": 1536, "d_ff": 4096, "lr": 0.0003, "lr_warmup": 5, "grad_clip": 1.0, "weight_decay": 0.0, "beta1": 0.9, "beta2": 0.95, "batch_size": 16, "seq_len": 1024, "precision": "fp8", "vocab_size": 50257, "steps": 60, "val_chunk_tokens": 16384, "seed": 0}, "eval_metrics": {"ok": true, "params_m": 607.4, "train_steps": 60, "train_loss_first": 11.109, "train_loss_last": 7.484, "val_bpb": 10.9593, "val_n_batches": 1, "mean_step_ms": 1819.18, "train_wall_s": 109.2, "val_wall_s": 0.51, "peak_gpu_mem_gib": 29.42}, "val_bpb": 10.9593, "baseline_val_bpb": 10.9554, "improvement_frac": -0.0004, "decision": "revert", "is_new_best": false, "nim_latency_s": 1.12, "iter_wall_s": 111.5}
{"iter": 27, "ts": "2026-04-25 18:45:30", "stage": "evaluated", "verdict_ok": true, "proposal": {"knob": "d_model", "new_value": 1536, "reason": "slightly larger hidden dimension"}, "diff": "--- a/cfg.py\n+++ b/cfg.py\n@@ -1 +1 @@\n-    d_model: int = 1024\n+    d_model: int = 1536\n", "candidate_cfg": {"n_layer": 24, "n_head": 16, "d_model": 1536, "d_ff": 4096, "lr": 0.0003, "lr_warmup": 5, "grad_clip": 1.0, "weight_decay": 0.0, "beta1": 0.9, "beta2": 0.95, "batch_size": 16, "seq_len": 1024, "precision": "fp8", "vocab_size": 50257, "steps": 60, "val_chunk_tokens": 16384, "seed": 0}, "eval_metrics": {"ok": true, "params_m": 607.4, "train_steps": 60, "train_loss_first": 11.075, "train_loss_last": 7.473, "val_bpb": 10.9422, "val_n_batches": 1, "mean_step_ms": 1790.19, "train_wall_s": 107.4, "val_wall_s": 0.48, "peak_gpu_mem_gib": 29.42}, "val_bpb": 10.9422, "baseline_val_bpb": 10.9554, "improvement_frac": 0.0012, "decision": "revert", "is_new_best": false, "nim_latency_s": 1.21, "iter_wall_s": 109.8}
{"iter": 28, "ts": "2026-04-25 18:46:50", "stage": "evaluated", "verdict_ok": true, "proposal": {"knob": "n_head", "new_value": 8, "reason": "Fewer attention heads may reduce overfitting"}, "diff": "--- a/cfg.py\n+++ b/cfg.py\n@@ -1 +1 @@\n-    n_head: int = 16\n+    n_head: int = 8\n", "candidate_cfg": {"n_layer": 24, "n_head": 8, "d_model": 1024, "d_ff": 4096, "lr": 0.0003, "lr_warmup": 5, "grad_clip": 1.0, "weight_decay": 0.0, "beta1": 0.9, "beta2": 0.95, "batch_size": 16, "seq_len": 1024, "precision": "fp8", "vocab_size": 50257, "steps": 60, "val_chunk_tokens": 16384, "seed": 0}, "eval_metrics": {"ok": true, "params_m": 354.6, "train_steps": 60, "train_loss_first": 11.009, "train_loss_last": 7.439, "val_bpb": 10.9504, "val_n_batches": 1, "mean_step_ms": 1290.45, "train_wall_s": 77.4, "val_wall_s": 0.37, "peak_gpu_mem_gib": 24.32}, "val_bpb": 10.9504, "baseline_val_bpb": 10.9554, "improvement_frac": 0.0005, "decision": "revert", "is_new_best": false, "nim_latency_s": 1.33, "iter_wall_s": 79.8}
{"iter": 29, "ts": "2026-04-25 18:48:37", "stage": "evaluated", "verdict_ok": true, "proposal": {"knob": "d_model", "new_value": 1536, "reason": "slightly smaller hidden dimension"}, "diff": "--- a/cfg.py\n+++ b/cfg.py\n@@ -1 +1 @@\n-    d_model: int = 1024\n+    d_model: int = 1536\n", "candidate_cfg": {"n_layer": 24, "n_head": 16, "d_model": 1536, "d_ff": 4096, "lr": 0.0003, "lr_warmup": 5, "grad_clip": 1.0, "weight_decay": 0.0, "beta1": 0.9, "beta2": 0.95, "batch_size": 16, "seq_len": 1024, "precision": "fp8", "vocab_size": 50257, "steps": 60, "val_chunk_tokens": 16384, "seed": 0}, "eval_metrics": {"ok": true, "params_m": 607.4, "train_steps": 60, "train_loss_first": 11.094, "train_loss_last": 7.484, "val_bpb": 10.946, "val_n_batches": 1, "mean_step_ms": 1749.12, "train_wall_s": 105.0, "val_wall_s": 0.47, "peak_gpu_mem_gib": 29.42}, "val_bpb": 10.946, "baseline_val_bpb": 10.9554, "improvement_frac": 0.0009, "decision": "revert", "is_new_best": false, "nim_latency_s": 1.2, "iter_wall_s": 107.3}
{"iter": 30, "ts": "2026-04-25 18:50:49", "stage": "evaluated", "verdict_ok": true, "proposal": {"knob": "d_model", "new_value": 2048, "reason": "increased hidden dim for better expressiveness"}, "diff": "--- a/cfg.py\n+++ b/cfg.py\n@@ -1 +1 @@\n-    d_model: int = 1024\n+    d_model: int = 2048\n", "candidate_cfg": {"n_layer": 24, "n_head": 16, "d_model": 2048, "d_ff": 4096, "lr": 0.0003, "lr_warmup": 5, "grad_clip": 1.0, "weight_decay": 0.0, "beta1": 0.9, "beta2": 0.95, "batch_size": 16, "seq_len": 1024, "precision": "fp8", "vocab_size": 50257, "steps": 60, "val_chunk_tokens": 16384, "seed": 0}, "eval_metrics": {"ok": true, "params_m": 910.53, "train_steps": 60, "train_loss_first": 11.344, "train_loss_last": 7.515, "val_bpb": 10.9393, "val_n_batches": 1, "mean_step_ms": 2148.99, "train_wall_s": 129.0, "val_wall_s": 0.59, "peak_gpu_mem_gib": 34.83}, "val_bpb": 10.9393, "baseline_val_bpb": 10.9554, "improvement_frac": 0.0015, "decision": "revert", "is_new_best": false, "nim_latency_s": 1.23, "iter_wall_s": 131.6}
{"iter": 31, "ts": "2026-04-25 18:51:51", "stage": "evaluated", "verdict_ok": true, "proposal": {"knob": "d_model", "new_value": 768, "reason": "lower hidden dim to reduce overfitting"}, "diff": "--- a/cfg.py\n+++ b/cfg.py\n@@ -1 +1 @@\n-    d_model: int = 1024\n+    d_model: int = 768\n", "candidate_cfg": {"n_layer": 24, "n_head": 16, "d_model": 768, "d_ff": 4096, "lr": 0.0003, "lr_warmup": 5, "grad_clip": 1.0, "weight_decay": 0.0, "beta1": 0.9, "beta2": 0.95, "batch_size": 16, "seq_len": 1024, "precision": "fp8", "vocab_size": 50257, "steps": 60, "val_chunk_tokens": 16384, "seed": 0}, "eval_metrics": {"ok": true, "params_m": 247.08, "train_steps": 60, "train_loss_first": 10.97, "train_loss_last": 7.533, "val_bpb": 10.8873, "val_n_batches": 1, "mean_step_ms": 1007.45, "train_wall_s": 60.5, "val_wall_s": 0.31, "peak_gpu_mem_gib": 21.97}, "val_bpb": 10.8873, "baseline_val_bpb": 10.9554, "improvement_frac": 0.0062, "decision": "keep", "is_new_best": false, "nim_latency_s": 1.19, "iter_wall_s": 62.6}
{"iter": 32, "ts": "2026-04-25 18:54:03", "stage": "evaluated", "verdict_ok": true, "proposal": {"knob": "d_model", "new_value": 2048, "reason": "Increase hidden dimension for more expressive representations."}, "diff": "--- a/cfg.py\n+++ b/cfg.py\n@@ -1 +1 @@\n-    d_model: int = 1024\n+    d_model: int = 2048\n", "candidate_cfg": {"n_layer": 24, "n_head": 16, "d_model": 2048, "d_ff": 4096, "lr": 0.0003, "lr_warmup": 5, "grad_clip": 1.0, "weight_decay": 0.0, "beta1": 0.9, "beta2": 0.95, "batch_size": 16, "seq_len": 1024, "precision": "fp8", "vocab_size": 50257, "steps": 60, "val_chunk_tokens": 16384, "seed": 0}, "eval_metrics": {"ok": true, "params_m": 910.53, "train_steps": 60, "train_loss_first": 11.264, "train_loss_last": 7.521, "val_bpb": 10.9236, "val_n_batches": 1, "mean_step_ms": 2149.71, "train_wall_s": 129.0, "val_wall_s": 0.59, "peak_gpu_mem_gib": 34.83}, "val_bpb": 10.9236, "baseline_val_bpb": 10.9554, "improvement_frac": 0.0029, "decision": "revert", "is_new_best": false, "nim_latency_s": 1.24, "iter_wall_s": 131.6}
{"iter": 33, "ts": "2026-04-25 18:55:06", "stage": "evaluated", "verdict_ok": true, "proposal": {"knob": "d_model", "new_value": 768, "reason": "smaller hidden dim for better generalization"}, "diff": "--- a/cfg.py\n+++ b/cfg.py\n@@ -1 +1 @@\n-    d_model: int = 1024\n+    d_model: int = 768\n", "candidate_cfg": {"n_layer": 24, "n_head": 16, "d_model": 768, "d_ff": 4096, "lr": 0.0003, "lr_warmup": 5, "grad_clip": 1.0, "weight_decay": 0.0, "beta1": 0.9, "beta2": 0.95, "batch_size": 16, "seq_len": 1024, "precision": "fp8", "vocab_size": 50257, "steps": 60, "val_chunk_tokens": 16384, "seed": 0}, "eval_metrics": {"ok": true, "params_m": 247.08, "train_steps": 60, "train_loss_first": 10.957, "train_loss_last": 7.529, "val_bpb": 10.8692, "val_n_batches": 1, "mean_step_ms": 1007.93, "train_wall_s": 60.5, "val_wall_s": 0.31, "peak_gpu_mem_gib": 21.98}, "val_bpb": 10.8692, "baseline_val_bpb": 10.9554, "improvement_frac": 0.0079, "decision": "keep", "is_new_best": false, "nim_latency_s": 1.2, "iter_wall_s": 62.6}
{"iter": 34, "ts": "2026-04-25 18:56:47", "stage": "evaluated", "verdict_ok": true, "proposal": {"knob": "d_model", "new_value": 1536, "reason": "slightly larger hidden dim might help"}, "diff": "--- a/cfg.py\n+++ b/cfg.py\n@@ -1 +1 @@\n-    d_model: int = 1024\n+    d_model: int = 1536\n", "candidate_cfg": {"n_layer": 24, "n_head": 16, "d_model": 1536, "d_ff": 4096, "lr": 0.0003, "lr_warmup": 5, "grad_clip": 1.0, "weight_decay": 0.0, "beta1": 0.9, "beta2": 0.95, "batch_size": 16, "seq_len": 1024, "precision": "fp8", "vocab_size": 50257, "steps": 60, "val_chunk_tokens": 16384, "seed": 0}, "eval_metrics": {"ok": true, "params_m": 607.4, "train_steps": 60, "train_loss_first": 11.09, "train_loss_last": 7.484, "val_bpb": 10.9127, "val_n_batches": 1, "mean_step_ms": 1646.19, "train_wall_s": 98.8, "val_wall_s": 0.48, "peak_gpu_mem_gib": 29.42}, "val_bpb": 10.9127, "baseline_val_bpb": 10.9554, "improvement_frac": 0.0039, "decision": "revert", "is_new_best": false, "nim_latency_s": 1.19, "iter_wall_s": 101.1}
{"iter": 35, "ts": "2026-04-25 18:57:59", "stage": "evaluated", "verdict_ok": true, "proposal": {"knob": "n_head", "new_value": 8, "reason": "Fewer attention heads may help with overfitting."}, "diff": "--- a/cfg.py\n+++ b/cfg.py\n@@ -1 +1 @@\n-    n_head: int = 16\n+    n_head: int = 8\n", "candidate_cfg": {"n_layer": 24, "n_head": 8, "d_model": 1024, "d_ff": 4096, "lr": 0.0003, "lr_warmup": 5, "grad_clip": 1.0, "weight_decay": 0.0, "beta1": 0.9, "beta2": 0.95, "batch_size": 16, "seq_len": 1024, "precision": "fp8", "vocab_size": 50257, "steps": 60, "val_chunk_tokens": 16384, "seed": 0}, "eval_metrics": {"ok": true, "params_m": 354.6, "train_steps": 60, "train_loss_first": 10.995, "train_loss_last": 7.446, "val_bpb": 10.9374, "val_n_batches": 1, "mean_step_ms": 1173.68, "train_wall_s": 70.4, "val_wall_s": 0.35, "peak_gpu_mem_gib": 24.32}, "val_bpb": 10.9374, "baseline_val_bpb": 10.9554, "improvement_frac": 0.0016, "decision": "revert", "is_new_best": false, "nim_latency_s": 1.31, "iter_wall_s": 72.7}
{"iter": 36, "ts": "2026-04-25 18:59:41", "stage": "evaluated", "verdict_ok": true, "proposal": {"knob": "d_model", "new_value": 1536, "reason": "slightly larger hidden dim might help"}, "diff": "--- a/cfg.py\n+++ b/cfg.py\n@@ -1 +1 @@\n-    d_model: int = 1024\n+    d_model: int = 1536\n", "candidate_cfg": {"n_layer": 24, "n_head": 16, "d_model": 1536, "d_ff": 4096, "lr": 0.0003, "lr_warmup": 5, "grad_clip": 1.0, "weight_decay": 0.0, "beta1": 0.9, "beta2": 0.95, "batch_size": 16, "seq_len": 1024, "precision": "fp8", "vocab_size": 50257, "steps": 60, "val_chunk_tokens": 16384, "seed": 0}, "eval_metrics": {"ok": true, "params_m": 607.4, "train_steps": 60, "train_loss_first": 11.132, "train_loss_last": 7.481, "val_bpb": 10.9571, "val_n_batches": 1, "mean_step_ms": 1653.76, "train_wall_s": 99.2, "val_wall_s": 0.48, "peak_gpu_mem_gib": 29.42}, "val_bpb": 10.9571, "baseline_val_bpb": 10.9554, "improvement_frac": -0.0002, "decision": "revert", "is_new_best": false, "nim_latency_s": 1.19, "iter_wall_s": 101.5}
{"iter": 37, "ts": "2026-04-25 19:00:58", "stage": "evaluated", "verdict_ok": true, "proposal": {"knob": "n_head", "new_value": 32, "reason": "increase attention heads to improve representation capacity"}, "diff": "--- a/cfg.py\n+++ b/cfg.py\n@@ -1 +1 @@\n-    n_head: int = 16\n+    n_head: int = 32\n", "candidate_cfg": {"n_layer": 24, "n_head": 32, "d_model": 1024, "d_ff": 4096, "lr": 0.0003, "lr_warmup": 5, "grad_clip": 1.0, "weight_decay": 0.0, "beta1": 0.9, "beta2": 0.95, "batch_size": 16, "seq_len": 1024, "precision": "fp8", "vocab_size": 50257, "steps": 60, "val_chunk_tokens": 16384, "seed": 0}, "eval_metrics": {"ok": true, "params_m": 354.6, "train_steps": 60, "train_loss_first": 11.031, "train_loss_last": 7.43, "val_bpb": 10.9469, "val_n_batches": 1, "mean_step_ms": 1245.15, "train_wall_s": 74.7, "val_wall_s": 0.36, "peak_gpu_mem_gib": 24.36}, "val_bpb": 10.9469, "baseline_val_bpb": 10.9554, "improvement_frac": 0.0008, "decision": "revert", "is_new_best": false, "nim_latency_s": 1.16, "iter_wall_s": 76.9}
{"iter": 38, "ts": "2026-04-25 19:01:38", "stage": "evaluated", "verdict_ok": true, "proposal": {"knob": "d_model", "new_value": 256, "reason": "Reducing hidden dim may help with overfitting"}, "diff": "--- a/cfg.py\n+++ b/cfg.py\n@@ -1 +1 @@\n-    d_model: int = 1024\n+    d_model: int = 256\n", "candidate_cfg": {"n_layer": 24, "n_head": 16, "d_model": 256, "d_ff": 4096, "lr": 0.0003, "lr_warmup": 5, "grad_clip": 1.0, "weight_decay": 0.0, "beta1": 0.9, "beta2": 0.95, "batch_size": 16, "seq_len": 1024, "precision": "fp8", "vocab_size": 50257, "steps": 60, "val_chunk_tokens": 16384, "seed": 0}, "eval_metrics": {"ok": true, "params_m": 69.78, "train_steps": 60, "train_loss_first": 10.873, "train_loss_last": 9.645, "val_bpb": 13.7575, "val_n_batches": 1, "mean_step_ms": 644.09, "train_wall_s": 38.7, "val_wall_s": 0.22, "peak_gpu_mem_gib": 17.44}, "val_bpb": 13.7575, "baseline_val_bpb": 10.9554, "improvement_frac": -0.2558, "decision": "revert", "is_new_best": false, "nim_latency_s": 1.28, "iter_wall_s": 40.7}
{"iter": 39, "ts": "2026-04-25 19:03:06", "stage": "evaluated", "verdict_ok": true, "proposal": {"knob": "n_head", "new_value": 4, "reason": "Reduce attention heads to see if it improves val_bpb"}, "diff": "--- a/cfg.py\n+++ b/cfg.py\n@@ -1 +1 @@\n-    n_head: int = 16\n+    n_head: int = 4\n", "candidate_cfg": {"n_layer": 24, "n_head": 4, "d_model": 1024, "d_ff": 4096, "lr": 0.0003, "lr_warmup": 5, "grad_clip": 1.0, "weight_decay": 0.0, "beta1": 0.9, "beta2": 0.95, "batch_size": 16, "seq_len": 1024, "precision": "fp8", "vocab_size": 50257, "steps": 60, "val_chunk_tokens": 16384, "seed": 0}, "eval_metrics": {"ok": true, "params_m": 354.6, "train_steps": 60, "train_loss_first": 11.018, "train_loss_last": 7.447, "val_bpb": 10.9487, "val_n_batches": 1, "mean_step_ms": 1415.98, "train_wall_s": 85.0, "val_wall_s": 0.36, "peak_gpu_mem_gib": 31.06}, "val_bpb": 10.9487, "baseline_val_bpb": 10.9554, "improvement_frac": 0.0006, "decision": "revert", "is_new_best": false, "nim_latency_s": 1.32, "iter_wall_s": 87.3}
{"iter": 40, "ts": "2026-04-25 19:04:33", "stage": "evaluated", "verdict_ok": true, "proposal": {"knob": "n_head", "new_value": 4, "reason": "fewer attention heads may help"}, "diff": "--- a/cfg.py\n+++ b/cfg.py\n@@ -1 +1 @@\n-    n_head: int = 16\n+    n_head: int = 4\n", "candidate_cfg": {"n_layer": 24, "n_head": 4, "d_model": 1024, "d_ff": 4096, "lr": 0.0003, "lr_warmup": 5, "grad_clip": 1.0, "weight_decay": 0.0, "beta1": 0.9, "beta2": 0.95, "batch_size": 16, "seq_len": 1024, "precision": "fp8", "vocab_size": 50257, "steps": 60, "val_chunk_tokens": 16384, "seed": 0}, "eval_metrics": {"ok": true, "params_m": 354.6, "train_steps": 60, "train_loss_first": 11.09, "train_loss_last": 7.438, "val_bpb": 10.9405, "val_n_batches": 1, "mean_step_ms": 1413.66, "train_wall_s": 84.8, "val_wall_s": 0.36, "peak_gpu_mem_gib": 31.06}, "val_bpb": 10.9405, "baseline_val_bpb": 10.9554, "improvement_frac": 0.0014, "decision": "revert", "is_new_best": false, "nim_latency_s": 1.11, "iter_wall_s": 87.0}
{"iter": 41, "ts": "2026-04-25 19:06:44", "stage": "evaluated", "verdict_ok": true, "proposal": {"knob": "d_model", "new_value": 2048, "reason": "Increase hidden dimension to see if it improves model capacity."}, "diff": "--- a/cfg.py\n+++ b/cfg.py\n@@ -1 +1 @@\n-    d_model: int = 1024\n+    d_model: int = 2048\n", "candidate_cfg": {"n_layer": 24, "n_head": 16, "d_model": 2048, "d_ff": 4096, "lr": 0.0003, "lr_warmup": 5, "grad_clip": 1.0, "weight_decay": 0.0, "beta1": 0.9, "beta2": 0.95, "batch_size": 16, "seq_len": 1024, "precision": "fp8", "vocab_size": 50257, "steps": 60, "val_chunk_tokens": 16384, "seed": 0}, "eval_metrics": {"ok": true, "params_m": 910.53, "train_steps": 60, "train_loss_first": 11.312, "train_loss_last": 7.521, "val_bpb": 10.9667, "val_n_batches": 1, "mean_step_ms": 2147.54, "train_wall_s": 128.9, "val_wall_s": 0.59, "peak_gpu_mem_gib": 34.83}, "val_bpb": 10.9667, "baseline_val_bpb": 10.9554, "improvement_frac": -0.001, "decision": "revert", "is_new_best": false, "nim_latency_s": 1.35, "iter_wall_s": 131.6}
{"iter": 42, "ts": "2026-04-25 19:07:58", "stage": "evaluated", "verdict_ok": true, "proposal": {"knob": "lr", "new_value": 0.0002, "reason": "slightly reduce peak learning rate"}, "diff": "--- a/cfg.py\n+++ b/cfg.py\n@@ -1 +1 @@\n-    lr: float = 0.0003\n+    lr: float = 0.0002\n", "candidate_cfg": {"n_layer": 24, "n_head": 16, "d_model": 1024, "d_ff": 4096, "lr": 0.0002, "lr_warmup": 5, "grad_clip": 1.0, "weight_decay": 0.0, "beta1": 0.9, "beta2": 0.95, "batch_size": 16, "seq_len": 1024, "precision": "fp8", "vocab_size": 50257, "steps": 60, "val_chunk_tokens": 16384, "seed": 0}, "eval_metrics": {"ok": true, "params_m": 354.6, "train_steps": 60, "train_loss_first": 11.049, "train_loss_last": 7.766, "val_bpb": 11.1193, "val_n_batches": 1, "mean_step_ms": 1182.28, "train_wall_s": 70.9, "val_wall_s": 0.35, "peak_gpu_mem_gib": 24.33}, "val_bpb": 11.1193, "baseline_val_bpb": 10.9554, "improvement_frac": -0.015, "decision": "revert", "is_new_best": false, "nim_latency_s": 1.19, "iter_wall_s": 73.1}
