{"_meta": "trajectory log; first record is baseline; subsequent records are agent iterations", "baseline_val_bpb": 10.9554, "baseline_cfg": {"n_layer": 24, "n_head": 16, "d_model": 1024, "d_ff": 4096, "lr": 0.0003, "lr_warmup": 5, "grad_clip": 1.0, "weight_decay": 0.0, "beta1": 0.9, "beta2": 0.95, "batch_size": 16, "seq_len": 1024, "precision": "fp8", "vocab_size": 50257, "steps": 60, "val_chunk_tokens": 16384, "seed": 0}, "accept_delta_frac": 0.005}
{"iter": 1, "ts": "2026-04-25 18:07:22", "stage": "evaluated", "verdict_ok": true, "proposal": {"knob": "n_head", "new_value": 8, "reason": "Fewer attention heads may reduce overfitting."}, "diff": "--- a/cfg.py\n+++ b/cfg.py\n@@ -1 +1 @@\n-    n_head: int = 16\n+    n_head: int = 8\n", "candidate_cfg": {"n_layer": 24, "n_head": 8, "d_model": 1024, "d_ff": 4096, "lr": 0.0003, "lr_warmup": 5, "grad_clip": 1.0, "weight_decay": 0.0, "beta1": 0.9, "beta2": 0.95, "batch_size": 16, "seq_len": 1024, "precision": "fp8", "vocab_size": 50257, "steps": 60, "val_chunk_tokens": 16384, "seed": 0}, "eval_metrics": {"ok": true, "params_m": 354.6, "train_steps": 60, "train_loss_first": 10.996, "train_loss_last": 7.446, "val_bpb": 10.9524, "val_n_batches": 1, "mean_step_ms": 1196.36, "train_wall_s": 71.8, "val_wall_s": 0.51, "peak_gpu_mem_gib": 24.31}, "val_bpb": 10.9524, "baseline_val_bpb": 10.9554, "improvement_frac": 0.0003, "decision": "revert", "is_new_best": true, "nim_latency_s": 1.3, "iter_wall_s": 74.2}
{"iter": 2, "ts": "2026-04-25 18:08:38", "stage": "evaluated", "verdict_ok": true, "proposal": {"knob": "n_head", "new_value": 32, "reason": "increase attention heads to explore larger model capacity"}, "diff": "--- a/cfg.py\n+++ b/cfg.py\n@@ -1 +1 @@\n-    n_head: int = 16\n+    n_head: int = 32\n", "candidate_cfg": {"n_layer": 24, "n_head": 32, "d_model": 1024, "d_ff": 4096, "lr": 0.0003, "lr_warmup": 5, "grad_clip": 1.0, "weight_decay": 0.0, "beta1": 0.9, "beta2": 0.95, "batch_size": 16, "seq_len": 1024, "precision": "fp8", "vocab_size": 50257, "steps": 60, "val_chunk_tokens": 16384, "seed": 0}, "eval_metrics": {"ok": true, "params_m": 354.6, "train_steps": 60, "train_loss_first": 10.994, "train_loss_last": 7.441, "val_bpb": 10.9362, "val_n_batches": 1, "mean_step_ms": 1239.5, "train_wall_s": 74.4, "val_wall_s": 0.49, "peak_gpu_mem_gib": 24.35}, "val_bpb": 10.9362, "baseline_val_bpb": 10.9554, "improvement_frac": 0.0018, "decision": "revert", "is_new_best": true, "nim_latency_s": 1.18, "iter_wall_s": 76.6}
{"iter": 3, "ts": "2026-04-25 18:10:25", "stage": "evaluated", "verdict_ok": true, "proposal": {"knob": "d_model", "new_value": 1536, "reason": "increase model capacity"}, "diff": "--- a/cfg.py\n+++ b/cfg.py\n@@ -1 +1 @@\n-    d_model: int = 1024\n+    d_model: int = 1536\n", "candidate_cfg": {"n_layer": 24, "n_head": 16, "d_model": 1536, "d_ff": 4096, "lr": 0.0003, "lr_warmup": 5, "grad_clip": 1.0, "weight_decay": 0.0, "beta1": 0.9, "beta2": 0.95, "batch_size": 16, "seq_len": 1024, "precision": "fp8", "vocab_size": 50257, "steps": 60, "val_chunk_tokens": 16384, "seed": 0}, "eval_metrics": {"ok": true, "params_m": 607.4, "train_steps": 60, "train_loss_first": 11.196, "train_loss_last": 7.478, "val_bpb": 10.9448, "val_n_batches": 1, "mean_step_ms": 1731.18, "train_wall_s": 103.9, "val_wall_s": 0.53, "peak_gpu_mem_gib": 29.41}, "val_bpb": 10.9448, "baseline_val_bpb": 10.9554, "improvement_frac": 0.001, "decision": "revert", "is_new_best": false, "nim_latency_s": 1.03, "iter_wall_s": 106.2}
{"iter": 4, "ts": "2026-04-25 18:11:28", "stage": "evaluated", "verdict_ok": true, "proposal": {"knob": "d_model", "new_value": 768, "reason": "reducing hidden dim may help"}, "diff": "--- a/cfg.py\n+++ b/cfg.py\n@@ -1 +1 @@\n-    d_model: int = 1024\n+    d_model: int = 768\n", "candidate_cfg": {"n_layer": 24, "n_head": 16, "d_model": 768, "d_ff": 4096, "lr": 0.0003, "lr_warmup": 5, "grad_clip": 1.0, "weight_decay": 0.0, "beta1": 0.9, "beta2": 0.95, "batch_size": 16, "seq_len": 1024, "precision": "fp8", "vocab_size": 50257, "steps": 60, "val_chunk_tokens": 16384, "seed": 0}, "eval_metrics": {"ok": true, "params_m": 247.08, "train_steps": 60, "train_loss_first": 11.005, "train_loss_last": 7.497, "val_bpb": 10.8722, "val_n_batches": 1, "mean_step_ms": 1025.01, "train_wall_s": 61.5, "val_wall_s": 0.33, "peak_gpu_mem_gib": 21.97}, "val_bpb": 10.8722, "baseline_val_bpb": 10.9554, "improvement_frac": 0.0076, "decision": "keep", "is_new_best": true, "nim_latency_s": 1.15, "iter_wall_s": 63.6}
{"iter": 5, "ts": "2026-04-25 18:12:32", "stage": "evaluated", "verdict_ok": true, "proposal": {"knob": "d_model", "new_value": 768, "reason": "lower d_model to reduce overfitting"}, "diff": "--- a/cfg.py\n+++ b/cfg.py\n@@ -1 +1 @@\n-    d_model: int = 1024\n+    d_model: int = 768\n", "candidate_cfg": {"n_layer": 24, "n_head": 16, "d_model": 768, "d_ff": 4096, "lr": 0.0003, "lr_warmup": 5, "grad_clip": 1.0, "weight_decay": 0.0, "beta1": 0.9, "beta2": 0.95, "batch_size": 16, "seq_len": 1024, "precision": "fp8", "vocab_size": 50257, "steps": 60, "val_chunk_tokens": 16384, "seed": 0}, "eval_metrics": {"ok": true, "params_m": 247.08, "train_steps": 60, "train_loss_first": 10.944, "train_loss_last": 7.541, "val_bpb": 10.9373, "val_n_batches": 1, "mean_step_ms": 1029.43, "train_wall_s": 61.8, "val_wall_s": 0.31, "peak_gpu_mem_gib": 21.97}, "val_bpb": 10.9373, "baseline_val_bpb": 10.9554, "improvement_frac": 0.0017, "decision": "revert", "is_new_best": false, "nim_latency_s": 1.21, "iter_wall_s": 63.8}
{"iter": 6, "ts": "2026-04-25 18:13:37", "stage": "evaluated", "verdict_ok": true, "proposal": {"knob": "d_model", "new_value": 768, "reason": "previous iteration improved with this value"}, "diff": "--- a/cfg.py\n+++ b/cfg.py\n@@ -1 +1 @@\n-    d_model: int = 1024\n+    d_model: int = 768\n", "candidate_cfg": {"n_layer": 24, "n_head": 16, "d_model": 768, "d_ff": 4096, "lr": 0.0003, "lr_warmup": 5, "grad_clip": 1.0, "weight_decay": 0.0, "beta1": 0.9, "beta2": 0.95, "batch_size": 16, "seq_len": 1024, "precision": "fp8", "vocab_size": 50257, "steps": 60, "val_chunk_tokens": 16384, "seed": 0}, "eval_metrics": {"ok": true, "params_m": 247.08, "train_steps": 60, "train_loss_first": 10.987, "train_loss_last": 7.519, "val_bpb": 10.8713, "val_n_batches": 1, "mean_step_ms": 1043.67, "train_wall_s": 62.6, "val_wall_s": 0.32, "peak_gpu_mem_gib": 21.97}, "val_bpb": 10.8713, "baseline_val_bpb": 10.9554, "improvement_frac": 0.0077, "decision": "keep", "is_new_best": true, "nim_latency_s": 1.12, "iter_wall_s": 64.6}
{"iter": 7, "ts": "2026-04-25 18:14:51", "stage": "evaluated", "verdict_ok": true, "proposal": {"knob": "n_head", "new_value": 8, "reason": "fewer attention heads may reduce overfitting"}, "diff": "--- a/cfg.py\n+++ b/cfg.py\n@@ -1 +1 @@\n-    n_head: int = 16\n+    n_head: int = 8\n", "candidate_cfg": {"n_layer": 24, "n_head": 8, "d_model": 1024, "d_ff": 4096, "lr": 0.0003, "lr_warmup": 5, "grad_clip": 1.0, "weight_decay": 0.0, "beta1": 0.9, "beta2": 0.95, "batch_size": 16, "seq_len": 1024, "precision": "fp8", "vocab_size": 50257, "steps": 60, "val_chunk_tokens": 16384, "seed": 0}, "eval_metrics": {"ok": true, "params_m": 354.6, "train_steps": 60, "train_loss_first": 11.016, "train_loss_last": 7.431, "val_bpb": 10.9245, "val_n_batches": 1, "mean_step_ms": 1205.19, "train_wall_s": 72.3, "val_wall_s": 0.36, "peak_gpu_mem_gib": 24.31}, "val_bpb": 10.9245, "baseline_val_bpb": 10.9554, "improvement_frac": 0.0028, "decision": "revert", "is_new_best": false, "nim_latency_s": 1.28, "iter_wall_s": 74.6}
{"iter": 8, "ts": "2026-04-25 18:16:09", "stage": "evaluated", "verdict_ok": true, "proposal": {"knob": "n_head", "new_value": 32, "reason": "increasing attention heads to explore more representations"}, "diff": "--- a/cfg.py\n+++ b/cfg.py\n@@ -1 +1 @@\n-    n_head: int = 16\n+    n_head: int = 32\n", "candidate_cfg": {"n_layer": 24, "n_head": 32, "d_model": 1024, "d_ff": 4096, "lr": 0.0003, "lr_warmup": 5, "grad_clip": 1.0, "weight_decay": 0.0, "beta1": 0.9, "beta2": 0.95, "batch_size": 16, "seq_len": 1024, "precision": "fp8", "vocab_size": 50257, "steps": 60, "val_chunk_tokens": 16384, "seed": 0}, "eval_metrics": {"ok": true, "params_m": 354.6, "train_steps": 60, "train_loss_first": 11.133, "train_loss_last": 7.442, "val_bpb": 10.9347, "val_n_batches": 1, "mean_step_ms": 1262.78, "train_wall_s": 75.8, "val_wall_s": 0.36, "peak_gpu_mem_gib": 24.35}, "val_bpb": 10.9347, "baseline_val_bpb": 10.9554, "improvement_frac": 0.0019, "decision": "revert", "is_new_best": false, "nim_latency_s": 1.22, "iter_wall_s": 77.9}
{"iter": 9, "ts": "2026-04-25 18:17:50", "stage": "evaluated", "verdict_ok": true, "proposal": {"knob": "d_model", "new_value": 1536, "reason": "Increase hidden dimension for better representation capacity."}, "diff": "--- a/cfg.py\n+++ b/cfg.py\n@@ -1 +1 @@\n-    d_model: int = 1024\n+    d_model: int = 1536\n", "candidate_cfg": {"n_layer": 24, "n_head": 16, "d_model": 1536, "d_ff": 4096, "lr": 0.0003, "lr_warmup": 5, "grad_clip": 1.0, "weight_decay": 0.0, "beta1": 0.9, "beta2": 0.95, "batch_size": 16, "seq_len": 1024, "precision": "fp8", "vocab_size": 50257, "steps": 60, "val_chunk_tokens": 16384, "seed": 0}, "eval_metrics": {"ok": true, "params_m": 607.4, "train_steps": 60, "train_loss_first": 11.131, "train_loss_last": 7.484, "val_bpb": 10.9504, "val_n_batches": 1, "mean_step_ms": 1642.11, "train_wall_s": 98.5, "val_wall_s": 0.48, "peak_gpu_mem_gib": 29.41}, "val_bpb": 10.9504, "baseline_val_bpb": 10.9554, "improvement_frac": 0.0005, "decision": "revert", "is_new_best": false, "nim_latency_s": 1.23, "iter_wall_s": 100.9}
{"iter": 10, "ts": "2026-04-25 18:19:19", "stage": "evaluated", "verdict_ok": true, "proposal": {"knob": "n_head", "new_value": 4, "reason": "try fewer attention heads"}, "diff": "--- a/cfg.py\n+++ b/cfg.py\n@@ -1 +1 @@\n-    n_head: int = 16\n+    n_head: int = 4\n", "candidate_cfg": {"n_layer": 24, "n_head": 4, "d_model": 1024, "d_ff": 4096, "lr": 0.0003, "lr_warmup": 5, "grad_clip": 1.0, "weight_decay": 0.0, "beta1": 0.9, "beta2": 0.95, "batch_size": 16, "seq_len": 1024, "precision": "fp8", "vocab_size": 50257, "steps": 60, "val_chunk_tokens": 16384, "seed": 0}, "eval_metrics": {"ok": true, "params_m": 354.6, "train_steps": 60, "train_loss_first": 11.096, "train_loss_last": 7.441, "val_bpb": 10.9401, "val_n_batches": 1, "mean_step_ms": 1439.45, "train_wall_s": 86.4, "val_wall_s": 0.58, "peak_gpu_mem_gib": 31.05}, "val_bpb": 10.9401, "baseline_val_bpb": 10.9554, "improvement_frac": 0.0014, "decision": "revert", "is_new_best": false, "nim_latency_s": 1.03, "iter_wall_s": 88.8}
{"iter": 11, "ts": "2026-04-25 18:21:04", "stage": "evaluated", "verdict_ok": true, "proposal": {"knob": "d_model", "new_value": 1536, "reason": "increase hidden dimension for better model capacity"}, "diff": "--- a/cfg.py\n+++ b/cfg.py\n@@ -1 +1 @@\n-    d_model: int = 1024\n+    d_model: int = 1536\n", "candidate_cfg": {"n_layer": 24, "n_head": 16, "d_model": 1536, "d_ff": 4096, "lr": 0.0003, "lr_warmup": 5, "grad_clip": 1.0, "weight_decay": 0.0, "beta1": 0.9, "beta2": 0.95, "batch_size": 16, "seq_len": 1024, "precision": "fp8", "vocab_size": 50257, "steps": 60, "val_chunk_tokens": 16384, "seed": 0}, "eval_metrics": {"ok": true, "params_m": 607.4, "train_steps": 60, "train_loss_first": 11.099, "train_loss_last": 7.474, "val_bpb": 10.9385, "val_n_batches": 1, "mean_step_ms": 1709.1, "train_wall_s": 102.6, "val_wall_s": 0.51, "peak_gpu_mem_gib": 29.41}, "val_bpb": 10.9385, "baseline_val_bpb": 10.9554, "improvement_frac": 0.0015, "decision": "revert", "is_new_best": false, "nim_latency_s": 1.2, "iter_wall_s": 105.0}
{"iter": 12, "ts": "2026-04-25 18:22:26", "stage": "evaluated", "verdict_ok": true, "proposal": {"knob": "d_ff", "new_value": 6144, "reason": "Increase FFN hidden dim to reduce overfitting"}, "diff": "--- a/cfg.py\n+++ b/cfg.py\n@@ -1 +1 @@\n-    d_ff: int = 4096\n+    d_ff: int = 6144\n", "candidate_cfg": {"n_layer": 24, "n_head": 16, "d_model": 1024, "d_ff": 6144, "lr": 0.0003, "lr_warmup": 5, "grad_clip": 1.0, "weight_decay": 0.0, "beta1": 0.9, "beta2": 0.95, "batch_size": 16, "seq_len": 1024, "precision": "fp8", "vocab_size": 50257, "steps": 60, "val_chunk_tokens": 16384, "seed": 0}, "eval_metrics": {"ok": true, "params_m": 455.27, "train_steps": 60, "train_loss_first": 11.012, "train_loss_last": 7.445, "val_bpb": 10.9125, "val_n_batches": 1, "mean_step_ms": 1331.72, "train_wall_s": 79.9, "val_wall_s": 0.4, "peak_gpu_mem_gib": 27.37}, "val_bpb": 10.9125, "baseline_val_bpb": 10.9554, "improvement_frac": 0.0039, "decision": "revert", "is_new_best": false, "nim_latency_s": 1.37, "iter_wall_s": 82.3}
{"iter": 13, "ts": "2026-04-25 18:23:39", "stage": "evaluated", "verdict_ok": true, "proposal": {"knob": "lr", "new_value": 0.0002, "reason": "slightly reducing learning rate for better convergence"}, "diff": "--- a/cfg.py\n+++ b/cfg.py\n@@ -1 +1 @@\n-    lr: float = 0.0003\n+    lr: float = 0.0002\n", "candidate_cfg": {"n_layer": 24, "n_head": 16, "d_model": 1024, "d_ff": 4096, "lr": 0.0002, "lr_warmup": 5, "grad_clip": 1.0, "weight_decay": 0.0, "beta1": 0.9, "beta2": 0.95, "batch_size": 16, "seq_len": 1024, "precision": "fp8", "vocab_size": 50257, "steps": 60, "val_chunk_tokens": 16384, "seed": 0}, "eval_metrics": {"ok": true, "params_m": 354.6, "train_steps": 60, "train_loss_first": 10.99, "train_loss_last": 7.708, "val_bpb": 11.0791, "val_n_batches": 1, "mean_step_ms": 1174.28, "train_wall_s": 70.5, "val_wall_s": 0.35, "peak_gpu_mem_gib": 24.33}, "val_bpb": 11.0791, "baseline_val_bpb": 10.9554, "improvement_frac": -0.0113, "decision": "revert", "is_new_best": false, "nim_latency_s": 1.28, "iter_wall_s": 72.7}
{"iter": 14, "ts": "2026-04-25 18:25:51", "stage": "evaluated", "verdict_ok": true, "proposal": {"knob": "d_model", "new_value": 2048, "reason": "Increase hidden dim for potentially better performance"}, "diff": "--- a/cfg.py\n+++ b/cfg.py\n@@ -1 +1 @@\n-    d_model: int = 1024\n+    d_model: int = 2048\n", "candidate_cfg": {"n_layer": 24, "n_head": 16, "d_model": 2048, "d_ff": 4096, "lr": 0.0003, "lr_warmup": 5, "grad_clip": 1.0, "weight_decay": 0.0, "beta1": 0.9, "beta2": 0.95, "batch_size": 16, "seq_len": 1024, "precision": "fp8", "vocab_size": 50257, "steps": 60, "val_chunk_tokens": 16384, "seed": 0}, "eval_metrics": {"ok": true, "params_m": 910.53, "train_steps": 60, "train_loss_first": 11.192, "train_loss_last": 7.512, "val_bpb": 10.9299, "val_n_batches": 1, "mean_step_ms": 2156.87, "train_wall_s": 129.4, "val_wall_s": 0.61, "peak_gpu_mem_gib": 34.83}, "val_bpb": 10.9299, "baseline_val_bpb": 10.9554, "improvement_frac": 0.0023, "decision": "revert", "is_new_best": false, "nim_latency_s": 1.19, "iter_wall_s": 132.1}
{"iter": 15, "ts": "2026-04-25 18:27:04", "stage": "evaluated", "verdict_ok": true, "proposal": {"knob": "lr", "new_value": 0.0002, "reason": "slightly lower learning rate to reduce overshooting"}, "diff": "--- a/cfg.py\n+++ b/cfg.py\n@@ -1 +1 @@\n-    lr: float = 0.0003\n+    lr: float = 0.0002\n", "candidate_cfg": {"n_layer": 24, "n_head": 16, "d_model": 1024, "d_ff": 4096, "lr": 0.0002, "lr_warmup": 5, "grad_clip": 1.0, "weight_decay": 0.0, "beta1": 0.9, "beta2": 0.95, "batch_size": 16, "seq_len": 1024, "precision": "fp8", "vocab_size": 50257, "steps": 60, "val_chunk_tokens": 16384, "seed": 0}, "eval_metrics": {"ok": true, "params_m": 354.6, "train_steps": 60, "train_loss_first": 11.042, "train_loss_last": 7.749, "val_bpb": 11.1329, "val_n_batches": 1, "mean_step_ms": 1175.17, "train_wall_s": 70.5, "val_wall_s": 0.35, "peak_gpu_mem_gib": 24.33}, "val_bpb": 11.1329, "baseline_val_bpb": 10.9554, "improvement_frac": -0.0162, "decision": "revert", "is_new_best": false, "nim_latency_s": 1.31, "iter_wall_s": 72.8}
{"iter": 16, "ts": "2026-04-25 18:28:20", "stage": "evaluated", "verdict_ok": true, "proposal": {"knob": "n_head", "new_value": 32, "reason": "increase attention heads to improve model capacity"}, "diff": "--- a/cfg.py\n+++ b/cfg.py\n@@ -1 +1 @@\n-    n_head: int = 16\n+    n_head: int = 32\n", "candidate_cfg": {"n_layer": 24, "n_head": 32, "d_model": 1024, "d_ff": 4096, "lr": 0.0003, "lr_warmup": 5, "grad_clip": 1.0, "weight_decay": 0.0, "beta1": 0.9, "beta2": 0.95, "batch_size": 16, "seq_len": 1024, "precision": "fp8", "vocab_size": 50257, "steps": 60, "val_chunk_tokens": 16384, "seed": 0}, "eval_metrics": {"ok": true, "params_m": 354.6, "train_steps": 60, "train_loss_first": 11.071, "train_loss_last": 7.423, "val_bpb": 10.935, "val_n_batches": 1, "mean_step_ms": 1246.25, "train_wall_s": 74.8, "val_wall_s": 0.37, "peak_gpu_mem_gib": 24.35}, "val_bpb": 10.935, "baseline_val_bpb": 10.9554, "improvement_frac": 0.0019, "decision": "revert", "is_new_best": false, "nim_latency_s": 1.16, "iter_wall_s": 76.9}
{"iter": 17, "ts": "2026-04-25 18:29:50", "stage": "evaluated", "verdict_ok": true, "proposal": {"knob": "d_ff", "new_value": 8192, "reason": "Increase d_ff to improve model capacity"}, "diff": "--- a/cfg.py\n+++ b/cfg.py\n@@ -1 +1 @@\n-    d_ff: int = 4096\n+    d_ff: int = 8192\n", "candidate_cfg": {"n_layer": 24, "n_head": 16, "d_model": 1024, "d_ff": 8192, "lr": 0.0003, "lr_warmup": 5, "grad_clip": 1.0, "weight_decay": 0.0, "beta1": 0.9, "beta2": 0.95, "batch_size": 16, "seq_len": 1024, "precision": "fp8", "vocab_size": 50257, "steps": 60, "val_chunk_tokens": 16384, "seed": 0}, "eval_metrics": {"ok": true, "params_m": 555.93, "train_steps": 60, "train_loss_first": 11.001, "train_loss_last": 7.476, "val_bpb": 10.9566, "val_n_batches": 1, "mean_step_ms": 1458.05, "train_wall_s": 87.5, "val_wall_s": 0.46, "peak_gpu_mem_gib": 30.33}, "val_bpb": 10.9566, "baseline_val_bpb": 10.9554, "improvement_frac": -0.0001, "decision": "revert", "is_new_best": false, "nim_latency_s": 1.18, "iter_wall_s": 89.8}
{"iter": 18, "ts": "2026-04-25 18:31:06", "stage": "evaluated", "verdict_ok": true, "proposal": {"knob": "n_head", "new_value": 8, "reason": "Fewer attention heads may reduce overfitting."}, "diff": "--- a/cfg.py\n+++ b/cfg.py\n@@ -1 +1 @@\n-    n_head: int = 16\n+    n_head: int = 8\n", "candidate_cfg": {"n_layer": 24, "n_head": 8, "d_model": 1024, "d_ff": 4096, "lr": 0.0003, "lr_warmup": 5, "grad_clip": 1.0, "weight_decay": 0.0, "beta1": 0.9, "beta2": 0.95, "batch_size": 16, "seq_len": 1024, "precision": "fp8", "vocab_size": 50257, "steps": 60, "val_chunk_tokens": 16384, "seed": 0}, "eval_metrics": {"ok": true, "params_m": 354.6, "train_steps": 60, "train_loss_first": 10.983, "train_loss_last": 7.447, "val_bpb": 10.9371, "val_n_batches": 1, "mean_step_ms": 1226.06, "train_wall_s": 73.6, "val_wall_s": 0.4, "peak_gpu_mem_gib": 24.31}, "val_bpb": 10.9371, "baseline_val_bpb": 10.9554, "improvement_frac": 0.0017, "decision": "revert", "is_new_best": false, "nim_latency_s": 1.29, "iter_wall_s": 75.9}
{"iter": 19, "ts": "2026-04-25 18:32:57", "stage": "evaluated", "verdict_ok": true, "proposal": {"knob": "d_model", "new_value": 1536, "reason": "increase hidden dimension"}, "diff": "--- a/cfg.py\n+++ b/cfg.py\n@@ -1 +1 @@\n-    d_model: int = 1024\n+    d_model: int = 1536\n", "candidate_cfg": {"n_layer": 24, "n_head": 16, "d_model": 1536, "d_ff": 4096, "lr": 0.0003, "lr_warmup": 5, "grad_clip": 1.0, "weight_decay": 0.0, "beta1": 0.9, "beta2": 0.95, "batch_size": 16, "seq_len": 1024, "precision": "fp8", "vocab_size": 50257, "steps": 60, "val_chunk_tokens": 16384, "seed": 0}, "eval_metrics": {"ok": true, "params_m": 607.4, "train_steps": 60, "train_loss_first": 11.22, "train_loss_last": 7.484, "val_bpb": 10.9767, "val_n_batches": 1, "mean_step_ms": 1811.77, "train_wall_s": 108.7, "val_wall_s": 0.53, "peak_gpu_mem_gib": 29.41}, "val_bpb": 10.9767, "baseline_val_bpb": 10.9554, "improvement_frac": -0.0019, "decision": "revert", "is_new_best": false, "nim_latency_s": 1.09, "iter_wall_s": 111.0}
{"iter": 20, "ts": "2026-04-25 18:34:17", "stage": "evaluated", "verdict_ok": true, "proposal": {"knob": "beta1", "new_value": 0.92, "reason": "slightly increase beta1 to encourage faster convergence"}, "diff": "--- a/cfg.py\n+++ b/cfg.py\n@@ -1 +1 @@\n-    beta1: float = 0.9\n+    beta1: float = 0.92\n", "candidate_cfg": {"n_layer": 24, "n_head": 16, "d_model": 1024, "d_ff": 4096, "lr": 0.0003, "lr_warmup": 5, "grad_clip": 1.0, "weight_decay": 0.0, "beta1": 0.92, "beta2": 0.95, "batch_size": 16, "seq_len": 1024, "precision": "fp8", "vocab_size": 50257, "steps": 60, "val_chunk_tokens": 16384, "seed": 0}, "eval_metrics": {"ok": true, "params_m": 354.6, "train_steps": 60, "train_loss_first": 11.028, "train_loss_last": 7.46, "val_bpb": 10.9616, "val_n_batches": 1, "mean_step_ms": 1285.66, "train_wall_s": 77.2, "val_wall_s": 0.35, "peak_gpu_mem_gib": 24.33}, "val_bpb": 10.9616, "baseline_val_bpb": 10.9554, "improvement_frac": -0.0006, "decision": "revert", "is_new_best": false, "nim_latency_s": 1.42, "iter_wall_s": 79.6}
{"iter": 21, "ts": "2026-04-25 18:35:36", "stage": "evaluated", "verdict_ok": true, "proposal": {"knob": "beta2", "new_value": 0.92, "reason": "slightly lower beta2 to stabilize training"}, "diff": "--- a/cfg.py\n+++ b/cfg.py\n@@ -1 +1 @@\n-    beta2: float = 0.95\n+    beta2: float = 0.92\n", "candidate_cfg": {"n_layer": 24, "n_head": 16, "d_model": 1024, "d_ff": 4096, "lr": 0.0003, "lr_warmup": 5, "grad_clip": 1.0, "weight_decay": 0.0, "beta1": 0.9, "beta2": 0.92, "batch_size": 16, "seq_len": 1024, "precision": "fp8", "vocab_size": 50257, "steps": 60, "val_chunk_tokens": 16384, "seed": 0}, "eval_metrics": {"ok": true, "params_m": 354.6, "train_steps": 60, "train_loss_first": 11.031, "train_loss_last": 7.448, "val_bpb": 10.9524, "val_n_batches": 1, "mean_step_ms": 1279.4, "train_wall_s": 76.8, "val_wall_s": 0.38, "peak_gpu_mem_gib": 24.33}, "val_bpb": 10.9524, "baseline_val_bpb": 10.9554, "improvement_frac": 0.0003, "decision": "revert", "is_new_best": false, "nim_latency_s": 1.35, "iter_wall_s": 79.1}
